{
  "creative_id": "product-proof-01",
  "platform": "meta",
  "placement": "feed",
  "aspect_ratio": "4:5",
  "goal": "clicks",
  "audience": {
    "persona": "busy professional who feels money quietly leaks out of their account",
    "pain": "forgotten subscriptions and lapsed free-trials keep charging every month",
    "desire": "see and stop wasted recurring spend in minutes, without a budgeting chore",
    "awareness_level": "solution_aware"
  },
  "strategy": {
    "angle": "product_proof",
    "hook": "See exactly where your money leaks.",
    "promise": "Find the subscriptions you forgot in about a minute.",
    "objection_addressed": "Another finance app I'll download and never open?",
    "proof_type": "demo"
  },
  "visual": {
    "template": "ui_screenshot",
    "style": "clean editorial product UI, single teal accent, soft shadows, light background",
    "scene": "a realistic Tally mobile app dashboard listing recurring subscriptions with one monthly total highlighted",
    "subject": "the Tally app dashboard shown on a phone-sized card",
    "composition": "app card centered slightly high; clean negative space reserved in the bottom third for overlay text",
    "focal_point": "the highlighted monthly total '$312/mo'",
    "props": [
      "one phone-sized app frame"
    ],
    "background": "plain off-white studio backdrop",
    "lighting": "soft, even studio light with a gentle shadow beneath the card"
  },
  "product": {
    "representation": "on-screen UI of the advertiser's own app (Tally)",
    "must_show": [
      "Tally logo",
      "teal accent color",
      "subscription list with a highlighted monthly total"
    ],
    "must_not_show": [
      "fabricated third-party brand logos",
      "invented endorsements",
      "real bank names or card numbers"
    ]
  },
  "copy": {
    "overlay_text": "Find the subscriptions you forgot about",
    "headline": "Stop paying for subscriptions you forgot",
    "primary_text": "Tally finds recurring charges quietly draining your account, then helps you cancel what you don't use.",
    "cta": "Try Tally Free"
  },
  "layout": {
    "overlay_position": "bottom",
    "typography": "bold condensed sans, high-contrast dark text, generous size",
    "safe_zones": "keep key UI and text within the central 90%; clear the bottom ~15% for platform primary text and CTA",
    "logo_position": "bottom-left"
  },
  "prompting": {
    "final_image_prompt": "A realistic, clean mobile finance app dashboard for an app called 'Tally', shown as a single phone-sized card floating on a plain off-white studio background. The screen lists a few recurring subscriptions with short generic placeholder names and small prices, and one large highlighted monthly total reading '$312/mo' in a teal accent. A small 'Tally' wordmark sits at the top of the app screen. Soft, even studio lighting with a gentle shadow under the card. Minimal and editorial, single teal accent color, with clean empty space in the lower third of the frame.",
    "negative_constraints": [
      "garbled or misspelled text",
      "real bank or brand logos",
      "fake play buttons or cursors",
      "cluttered UI",
      "extra fingers"
    ],
    "reference_images": []
  },
  "qa": {
    "readability_check": "Overlay reads in one glance; dark text on light UI passes the thumbnail squint test.",
    "native_platform_check": "Reads like a real product screenshot, native to Meta feed; not stocky or corporate.",
    "policy_risks": [
      "Dollar figures shown in the UI are illustrative sample data, not a specific user's result \u2014 keep them clearly representative, never presented as a testimonial."
    ],
    "iteration_notes": "Test a 1:1 variant and a version with the total in the upper third; A/B the headline against a question hook."
  }
}