{
  "creative_id": "reddit-native-01",
  "platform": "reddit",
  "placement": "reddit_feed",
  "aspect_ratio": "1:1",
  "goal": "clicks",
  "audience": {
    "persona": "Redditor in a personal-finance community who hates wasting money",
    "pain": "small recurring charges add up unnoticed over months",
    "desire": "an easy, no-spreadsheet way to catch them",
    "awareness_level": "problem_aware"
  },
  "strategy": {
    "angle": "reddit_native",
    "hook": "What finally stopped my subscription creep",
    "promise": "A 60-second scan that surfaces the leaks.",
    "objection_addressed": "Is this just another budgeting app?",
    "proof_type": "social_proof"
  },
  "visual": {
    "template": "native_social_post",
    "style": "authentic Reddit post card UI, neutral light mode, believable",
    "scene": "a Reddit-style post card with a placeholder subreddit label, a bold title, an upvote arrow, and two short lines of body text",
    "subject": "the post card",
    "composition": "the post card fills the frame with small even margins",
    "focal_point": "the bold post title",
    "props": [],
    "background": "light neutral UI background",
    "lighting": "flat UI lighting"
  },
  "product": {
    "representation": "implied (mentioned in the post body; no product UI shown)",
    "must_show": [
      "generic, clearly-placeholder Reddit-style UI"
    ],
    "must_not_show": [
      "real subreddit names presented as authentic",
      "real usernames or avatars",
      "fabricated third-party logos",
      "invented endorsements",
      "upvote counts presented as real"
    ]
  },
  "copy": {
    "overlay_text": "What finally stopped my subscription creep",
    "headline": "How I caught my forgotten subscriptions",
    "primary_text": "Posting in case it helps someone: I kept getting nickel-and-dimed by trials I forgot about. A quick scan surfaced them all.",
    "cta": "See How It Works"
  },
  "layout": {
    "overlay_position": "center",
    "typography": "native Reddit post typography, bold title weight",
    "safe_zones": "keep title and body within the central 88%",
    "logo_position": "none"
  },
  "prompting": {
    "final_image_prompt": "A clean, believable Reddit-style post card in light mode: a generic, clearly-placeholder subreddit label (not a real community name), a small upvote arrow, a bold post title, and two short lines of body text in a neutral sans-serif. No real usernames, no real avatars, no specific vote numbers. Plain light background around the card.",
    "negative_constraints": [
      "garbled or misspelled text",
      "real usernames or avatars",
      "vote counts implied as authentic",
      "real brand logos"
    ],
    "reference_images": []
  },
  "qa": {
    "readability_check": "Title legible at thumbnail size; clean native Reddit look.",
    "native_platform_check": "Reads as a native Reddit post in the community's voice, not an obvious ad.",
    "policy_risks": [
      "Illustrative/representative post \u2014 not a real user testimonial and not a real subreddit; rendered as a clearly-placeholder card with no real vote counts."
    ],
    "iteration_notes": "Test a contrarian title; cut a Meta-feed screenshot variant of the same card."
  }
}