{
  "creative_id": "pain-agitation-01",
  "platform": "meta",
  "placement": "feed",
  "aspect_ratio": "4:5",
  "goal": "clicks",
  "audience": {
    "persona": "person who suspects small recurring charges are adding up but hasn't looked",
    "pain": "free trials that auto-converted and old subscriptions keep charging unnoticed",
    "desire": "stop paying for things they no longer use",
    "awareness_level": "problem_aware"
  },
  "strategy": {
    "angle": "pain_agitation",
    "hook": "Still paying for that 2021 free trial?",
    "promise": "Tally surfaces what you forgot so you can cancel it.",
    "objection_addressed": "I don't have time to audit my bank statements.",
    "proof_type": "visual_metaphor"
  },
  "visual": {
    "template": "pain_metaphor",
    "style": "clean conceptual still life, single bold accent, editorial",
    "scene": "a long printed receipt spilling and tangling out of a smartphone, symbolizing money quietly leaking",
    "subject": "one smartphone with a long printed receipt tangling outward and down",
    "composition": "phone in the upper-middle, receipt spilling down through the frame; clean negative space reserved at the top for overlay text",
    "focal_point": "the long, tangled receipt",
    "props": [
      "one smartphone",
      "one long paper receipt"
    ],
    "background": "plain warm off-white surface",
    "lighting": "soft top light with a soft shadow"
  },
  "product": {
    "representation": "implied (named in copy; UI not shown)",
    "must_show": [
      "small Tally wordmark, bottom"
    ],
    "must_not_show": [
      "fabricated third-party logos",
      "invented endorsements",
      "real bank names"
    ]
  },
  "copy": {
    "overlay_text": "Still paying for that 2021 free trial?",
    "headline": "Cancel subscriptions you forgot about",
    "primary_text": "Old free trials and forgotten subscriptions keep charging your card. Tally spots them so you can cancel in a tap.",
    "cta": "Find Them Free"
  },
  "layout": {
    "overlay_position": "top",
    "typography": "bold sans, high contrast, generous size",
    "safe_zones": "clear the top ~10% and bottom ~15% for platform chrome",
    "logo_position": "bottom-left"
  },
  "prompting": {
    "final_image_prompt": "",
    "negative_constraints": [
      "garbled text",
      "real brand logos",
      "extra fingers",
      "cluttered background"
    ],
    "reference_images": []
  },
  "qa": {
    "readability_check": "Single bold question reads instantly at the top; strong figure-ground contrast.",
    "native_platform_check": "Conceptual but candid; reads native to feed, not stocky.",
    "policy_risks": [],
    "iteration_notes": "Test a receipt-pile vs. a single glowing recurring charge; cut a 9:16 story variant."
  }
}